{
  "certification_policy": {
    "candidate_classification_is_certification": false,
    "maximum_proven_state": "SOURCE_PRESENT",
    "ordinary_user_executable": false
  },
  "direction_counts": {
    "READER": 31,
    "WRITER": 41
  },
  "plugin_count": 72,
  "plugins": [
    {
      "candidate_scope": "NONE",
      "certification_state": "SOURCE_PRESENT",
      "direction": "WRITER",
      "maven_artifact_id": "adbmysqlwriter",
      "module": "adbmysqlwriter",
      "module_pom_path": "third_party/alibaba-datax/adbmysqlwriter/pom.xml",
      "module_pom_sha256": "8e141b58ecf65554b1ad10c04ae605853738aceb10ee6c116ab03a900aa0ad21",
      "ordinary_user_executable": false,
      "plugin_class": "com.alibaba.datax.plugin.writer.adbmysqlwriter.AdbMysqlWriter",
      "plugin_json_path": "third_party/alibaba-datax/adbmysqlwriter/src/main/resources/plugin.json",
      "plugin_json_sha256": "cf0278ca94f434dbb61e78c0da4921597335b1f24d3ff775e03b27584396b589",
      "plugin_name": "adbmysqlwriter"
    },
    {
      "candidate_scope": "NONE",
      "certification_state": "SOURCE_PRESENT",
      "direction": "WRITER",
      "maven_artifact_id": "adbpgwriter",
      "module": "adbpgwriter",
      "module_pom_path": "third_party/alibaba-datax/adbpgwriter/pom.xml",
      "module_pom_sha256": "3ff5d29dd3462291a2f4c174b751f8dbc1f3cb2ce9d980509ac3b7c3918b7731",
      "ordinary_user_executable": false,
      "plugin_class": "com.alibaba.datax.plugin.writer.adbpgwriter.AdbpgWriter",
      "plugin_json_path": "third_party/alibaba-datax/adbpgwriter/src/main/resources/plugin.json",
      "plugin_json_sha256": "8fcf75c74b4eb2fd35271c119a17317af8b96a141985c6fdb300f778ecc7b1af",
      "plugin_name": "adbpgwriter"
    },
    {
      "candidate_scope": "NONE",
      "certification_state": "SOURCE_PRESENT",
      "direction": "WRITER",
      "maven_artifact_id": "adswriter",
      "module": "adswriter",
      "module_pom_path": "third_party/alibaba-datax/adswriter/pom.xml",
      "module_pom_sha256": "6e181f62a5ea3f9094d4ed8100e720dff2c92479d59682c60b8039d05e8070f3",
      "ordinary_user_executable": false,
      "plugin_class": "com.alibaba.datax.plugin.writer.adswriter.AdsWriter",
      "plugin_json_path": "third_party/alibaba-datax/adswriter/src/main/resources/plugin.json",
      "plugin_json_sha256": "2c5815ab1e33cbc11014bced9b2d5fed9d4356f7bb8eecda1489115308797e75",
      "plugin_name": "adswriter"
    },
    {
      "candidate_scope": "NONE",
      "certification_state": "SOURCE_PRESENT",
      "direction": "READER",
      "maven_artifact_id": "cassandrareader",
      "module": "cassandrareader",
      "module_pom_path": "third_party/alibaba-datax/cassandrareader/pom.xml",
      "module_pom_sha256": "15bb5ea8dd164c492210452c051e4dc647c1ff5ac38190648e7cc9b0e096156c",
      "ordinary_user_executable": false,
      "plugin_class": "com.alibaba.datax.plugin.reader.cassandrareader.CassandraReader",
      "plugin_json_path": "third_party/alibaba-datax/cassandrareader/src/main/resources/plugin.json",
      "plugin_json_sha256": "0de2a95bb0035b50a7061fbfc66946947949103b0dccb85a3fa27256e0c69660",
      "plugin_name": "cassandrareader"
    },
    {
      "candidate_scope": "NONE",
      "certification_state": "SOURCE_PRESENT",
      "direction": "WRITER",
      "maven_artifact_id": "cassandrawriter",
      "module": "cassandrawriter",
      "module_pom_path": "third_party/alibaba-datax/cassandrawriter/pom.xml",
      "module_pom_sha256": "094b7f80bdcef4f3850155313512aed8c98ea3f5397fecd2c513537112852c33",
      "ordinary_user_executable": false,
      "plugin_class": "com.alibaba.datax.plugin.writer.cassandrawriter.CassandraWriter",
      "plugin_json_path": "third_party/alibaba-datax/cassandrawriter/src/main/resources/plugin.json",
      "plugin_json_sha256": "15c62caf8feb7b8db6f714756cc0647d54ad445ccced3b9d18cd5c19e5610447",
      "plugin_name": "cassandrawriter"
    },
    {
      "candidate_scope": "NONE",
      "certification_state": "SOURCE_PRESENT",
      "direction": "READER",
      "maven_artifact_id": "clickhousereader",
      "module": "clickhousereader",
      "module_pom_path": "third_party/alibaba-datax/clickhousereader/pom.xml",
      "module_pom_sha256": "d0312f0d86dc3e8cf2eb41271d302f46e834b93baf934e1ed0ad59f0e83d1b03",
      "ordinary_user_executable": false,
      "plugin_class": "com.alibaba.datax.plugin.reader.clickhousereader.ClickhouseReader",
      "plugin_json_path": "third_party/alibaba-datax/clickhousereader/src/main/resources/plugin.json",
      "plugin_json_sha256": "d46a9eb295cfd1906e800e8532dfa8a4124c2c59c0d0fc15eb76b44fc6c18d87",
      "plugin_name": "clickhousereader"
    },
    {
      "candidate_scope": "NONE",
      "certification_state": "SOURCE_PRESENT",
      "direction": "WRITER",
      "maven_artifact_id": "clickhousewriter",
      "module": "clickhousewriter",
      "module_pom_path": "third_party/alibaba-datax/clickhousewriter/pom.xml",
      "module_pom_sha256": "80967aed27af26728d6eb0f10cee2db006030d899a3b8a04a5a8dd39590bce0d",
      "ordinary_user_executable": false,
      "plugin_class": "com.alibaba.datax.plugin.writer.clickhousewriter.ClickhouseWriter",
      "plugin_json_path": "third_party/alibaba-datax/clickhousewriter/src/main/resources/plugin.json",
      "plugin_json_sha256": "02393efa5d8879d6bfcd4dcb38f9f6d6c748a5bab4afecfe9710bf09be47812a",
      "plugin_name": "clickhousewriter"
    },
    {
      "candidate_scope": "NONE",
      "certification_state": "SOURCE_PRESENT",
      "direction": "WRITER",
      "maven_artifact_id": "databendwriter",
      "module": "databendwriter",
      "module_pom_path": "third_party/alibaba-datax/databendwriter/pom.xml",
      "module_pom_sha256": "4266b0b74b55fe4e3f02c45680661b250435ff6917db1c1cab279d24e5ed7dde",
      "ordinary_user_executable": false,
      "plugin_class": "com.alibaba.datax.plugin.writer.databendwriter.DatabendWriter",
      "plugin_json_path": "third_party/alibaba-datax/databendwriter/src/main/resources/plugin.json",
      "plugin_json_sha256": "42b81861cdd4457add75943b54fd6bb8af0c924ddceedc2e73ad71a5c8a294a0",
      "plugin_name": "databendwriter"
    },
    {
      "candidate_scope": "NONE",
      "certification_state": "SOURCE_PRESENT",
      "direction": "READER",
      "maven_artifact_id": "datahubreader",
      "module": "datahubreader",
      "module_pom_path": "third_party/alibaba-datax/datahubreader/pom.xml",
      "module_pom_sha256": "a43e0d922ab7d76a4433ea3ab2589c983e687c9a131d12d10e02ab604861a30e",
      "ordinary_user_executable": false,
      "plugin_class": "com.alibaba.datax.plugin.reader.datahubreader.DatahubReader",
      "plugin_json_path": "third_party/alibaba-datax/datahubreader/src/main/resources/plugin.json",
      "plugin_json_sha256": "60191df169bc6b58a289f9428d4318fddcd088577a4bf2311bd39a4c80dab557",
      "plugin_name": "datahubreader"
    },
    {
      "candidate_scope": "NONE",
      "certification_state": "SOURCE_PRESENT",
      "direction": "WRITER",
      "maven_artifact_id": "datahubwriter",
      "module": "datahubwriter",
      "module_pom_path": "third_party/alibaba-datax/datahubwriter/pom.xml",
      "module_pom_sha256": "8df88321c8a12c43acd46206661a5afe045fde0680bb64593d1955c6ca432053",
      "ordinary_user_executable": false,
      "plugin_class": "com.alibaba.datax.plugin.writer.datahubwriter.DatahubWriter",
      "plugin_json_path": "third_party/alibaba-datax/datahubwriter/src/main/resources/plugin.json",
      "plugin_json_sha256": "c809282f81a084aae8a7c35dc2b06aada93ab926dde3d1f5b712077a8465d324",
      "plugin_name": "datahubwriter"
    },
    {
      "candidate_scope": "NONE",
      "certification_state": "SOURCE_PRESENT",
      "direction": "WRITER",
      "maven_artifact_id": "doriswriter",
      "module": "doriswriter",
      "module_pom_path": "third_party/alibaba-datax/doriswriter/pom.xml",
      "module_pom_sha256": "baa6d8652161a3f08109d06b7aa317bdb6bc4942b85268fd8cf5a202751b3b3d",
      "ordinary_user_executable": false,
      "plugin_class": "com.alibaba.datax.plugin.writer.doriswriter.DorisWriter",
      "plugin_json_path": "third_party/alibaba-datax/doriswriter/src/main/resources/plugin.json",
      "plugin_json_sha256": "44ab4aaabd37979c51559f547a1e4d66c56d3e4786b6f9777eadaed000a6e548",
      "plugin_name": "doriswriter"
    },
    {
      "candidate_scope": "NONE",
      "certification_state": "SOURCE_PRESENT",
      "direction": "READER",
      "maven_artifact_id": "drdsreader",
      "module": "drdsreader",
      "module_pom_path": "third_party/alibaba-datax/drdsreader/pom.xml",
      "module_pom_sha256": "8ceee186fc676a327ecad46d36b8114c4629d4ea4efee573d0e6f6b97e734875",
      "ordinary_user_executable": false,
      "plugin_class": "com.alibaba.datax.plugin.reader.drdsreader.DrdsReader",
      "plugin_json_path": "third_party/alibaba-datax/drdsreader/src/main/resources/plugin.json",
      "plugin_json_sha256": "a1b3dcf38155f02d816f07bf0aef7f15295c677e5f1408fb8da70325d53b5480",
      "plugin_name": "drdsreader"
    },
    {
      "candidate_scope": "NONE",
      "certification_state": "SOURCE_PRESENT",
      "direction": "WRITER",
      "maven_artifact_id": "drdswriter",
      "module": "drdswriter",
      "module_pom_path": "third_party/alibaba-datax/drdswriter/pom.xml",
      "module_pom_sha256": "ac10b0362e81e1f1c33cc3310b705121d640f996eca6be5b6dc86ef55c28b49a",
      "ordinary_user_executable": false,
      "plugin_class": "com.alibaba.datax.plugin.writer.drdswriter.DrdsWriter",
      "plugin_json_path": "third_party/alibaba-datax/drdswriter/src/main/resources/plugin.json",
      "plugin_json_sha256": "d354661f845cbf34f39c840e48f950a8708e7e4513236c85d5e7b01f75f03b80",
      "plugin_name": "drdswriter"
    },
    {
      "candidate_scope": "NONE",
      "certification_state": "SOURCE_PRESENT",
      "direction": "WRITER",
      "maven_artifact_id": "elasticsearchwriter",
      "module": "elasticsearchwriter",